Section Title,Nested Content
8. Responsibilities of the refurbisher.,"collect e-waste generated during the process of refurbishing and channelise the waste to authorised dismantler or recycler through its collection centre;, make an application in Form 1(a) in accordance with the procedure laid down in sub-rule (4) of rule 13 to the concerned State Pollution Control Board for grant of one time authorisation;, the concerned State Pollution Control Board shall authorise the Refurbisher on one time basis as per Form 1 (bb) and authorisation would be deemed as considered if not objected to within a period of thirty days;, the authorised Refurbisher shall be required to submit details of e-waste generated to the concerned State Pollution Control Board on yearly basis;, ensure that no damage is caused to the environment during storage and transportation of e-waste;, ensure that the refurbishing process do not have any adverse effect on the health and the environment;, ensure that the e-waste thus generated is safely transported to authorised collection centres or dismantlers or recyclers;, file annual returns in Form-3 to the concerned State Pollution Control Board, on or before the 30th day of June following the financial year to which that return relates;, maintain records of the e-waste handled in Form-2 and such records should be available for scrutiny by the appropriate authority."
8. Responsibilities of the refurbisher.,collect e-waste generated during the process of refurbishing and channelise the waste to authorised dismantler or recycler through its collection centre;
8. Responsibilities of the refurbisher.,"make an application in Form 1(a) in accordance with the procedure laid down in sub-rule (4) of rule 13 to the concerned State Pollution Control Board for grant of one time authorisation;, the concerned State Pollution Control Board shall authorise the Refurbisher on one time basis as per Form 1 (bb) and authorisation would be deemed as considered if not objected to within a period of thirty days;, the authorised Refurbisher shall be required to submit details of e-waste generated to the concerned State Pollution Control Board on yearly basis;"
8. Responsibilities of the refurbisher.,the concerned State Pollution Control Board shall authorise the Refurbisher on one time basis as per Form 1 (bb) and authorisation would be deemed as considered if not objected to within a period of thirty days;
8. Responsibilities of the refurbisher.,the authorised Refurbisher shall be required to submit details of e-waste generated to the concerned State Pollution Control Board on yearly basis;
8. Responsibilities of the refurbisher.,ensure that no damage is caused to the environment during storage and transportation of e-waste;
8. Responsibilities of the refurbisher.,ensure that the refurbishing process do not have any adverse effect on the health and the environment;
8. Responsibilities of the refurbisher.,ensure that the e-waste thus generated is safely transported to authorised collection centres or dismantlers or recyclers;
8. Responsibilities of the refurbisher.,"file annual returns in Form-3 to the concerned State Pollution Control Board, on or before the 30th day of June following the financial year to which that return relates;"
8. Responsibilities of the refurbisher.,maintain records of the e-waste handled in Form-2 and such records should be available for scrutiny by the appropriate authority.
9. Responsibilities of consumer or bulk consumer.,"consumers or bulk consumers of electrical and electronic equipment listed in Schedule I shall ensure that e-waste generated by them is channelised through collection centre or dealer of authorised producer or dismantler or recycler or through the designated take back service provider of the producer to authorised dismantler or recycler;, bulk consumers of electrical and electronic equipment listed in Schedule I shall maintain records of e-waste generated by them in Form-2 and make such records available for scrutiny by the concerned State Pollution Control Board;, consumers or bulk consumers of electrical and electronic equipment listed in Schedule I shall ensure that such end-of-life electrical and electronic equipment are not admixed with e-waste containing radioactive material as covered under the provisions of the Atomic Energy Act, 1962 (33 of 1962) and rules made there under;, bulk consumers of electrical and electronic equipment listed in Schedule I shall file annual returns in Form-3, to the concerned State Pollution Control Board on or before the 30th day of June following the financial year to which that return relates. In case of the bulk consumer with multiple offices in a State, one annual return combining information from all the offices shall be filed to the concerned State Pollution Control Board on or before the 30th day of June following the financial year to which that return relates"
9. Responsibilities of consumer or bulk consumer.,consumers or bulk consumers of electrical and electronic equipment listed in Schedule I shall ensure that e-waste generated by them is channelised through collection centre or dealer of authorised producer or dismantler or recycler or through the designated take back service provider of the producer to authorised dismantler or recycler;
9. Responsibilities of consumer or bulk consumer.,bulk consumers of electrical and electronic equipment listed in Schedule I shall maintain records of e-waste generated by them in Form-2 and make such records available for scrutiny by the concerned State Pollution Control Board;
9. Responsibilities of consumer or bulk consumer.,"consumers or bulk consumers of electrical and electronic equipment listed in Schedule I shall ensure that such end-of-life electrical and electronic equipment are not admixed with e-waste containing radioactive material as covered under the provisions of the Atomic Energy Act, 1962 (33 of 1962) and rules made there under;"
9. Responsibilities of consumer or bulk consumer.,"bulk consumers of electrical and electronic equipment listed in Schedule I shall file annual returns in Form-3, to the concerned State Pollution Control Board on or before the 30th day of June following the financial year to which that return relates. In case of the bulk consumer with multiple offices in a State, one annual return combining information from all the offices shall be filed to the concerned State Pollution Control Board on or before the 30th day of June following the financial year to which that return relates"
10. Responsibilities of the dismantler.,"ensure that the facility and dismantling processes are in accordance with the standards or guidelines prescribed by Central Pollution Control Board from time to time;, obtain authorisation from the concerned State Pollution Control Board in accordance with the procedure under sub-rule (3) of rule 13;, ensure that no damage is caused to the environment during storage and transportation of e-waste;, ensure that the dismantling processes do not have any adverse effect on the health and the environment;, ensure that dismantled e-waste are segregated and sent to the authorised recycling facilities for recovery of materials;, ensure that non-recyclable or non-recoverable components are sent to authorised treatment storage and disposal facilities;, maintain record of e-waste collected, dismantled and sent to authorised recycler in Form-2 and make such record available for scrutiny by the Central Pollution Control Board or the concerned State Pollution Control Board;, file a return in Form-3, to the concerned State Pollution Control Board as the case may be, on or before 30th day of June following the financial year to which that return relates;, not process any e-waste for recovery or refining of materials, unless he is authorised with concerned State Pollution Control Board as a recycler for refining and recovery of materials;, operation without Authorisation by any dismantler, as defined in this rule, shall be considered as causing damage to the environment."
10. Responsibilities of the dismantler.,ensure that the facility and dismantling processes are in accordance with the standards or guidelines prescribed by Central Pollution Control Board from time to time;
10. Responsibilities of the dismantler.,obtain authorisation from the concerned State Pollution Control Board in accordance with the procedure under sub-rule (3) of rule 13;
10. Responsibilities of the dismantler.,ensure that no damage is caused to the environment during storage and transportation of e-waste;
10. Responsibilities of the dismantler.,ensure that the dismantling processes do not have any adverse effect on the health and the environment;
10. Responsibilities of the dismantler.,ensure that dismantled e-waste are segregated and sent to the authorised recycling facilities for recovery of materials;
10. Responsibilities of the dismantler.,ensure that non-recyclable or non-recoverable components are sent to authorised treatment storage and disposal facilities;
10. Responsibilities of the dismantler.,"maintain record of e-waste collected, dismantled and sent to authorised recycler in Form-2 and make such record available for scrutiny by the Central Pollution Control Board or the concerned State Pollution Control Board;"
10. Responsibilities of the dismantler.,"file a return in Form-3, to the concerned State Pollution Control Board as the case may be, on or before 30th day of June following the financial year to which that return relates;"
10. Responsibilities of the dismantler.,"not process any e-waste for recovery or refining of materials, unless he is authorised with concerned State Pollution Control Board as a recycler for refining and recovery of materials;"
10. Responsibilities of the dismantler.,"operation without Authorisation by any dismantler, as defined in this rule, shall be considered as causing damage to the environment."
11. Responsibilities of the recycler.,"shall ensure that the facility and recycling processes are in accordance with the standards or guidelines prescribed by the Central Pollution Control Board from time to time;, obtain authorisation from concerned State Pollution Control Board in accordance with the procedure under the sub-rule (3) of rule 13;, ensure that no damage is caused to the environment during storage and transportation of e-waste;, ensure that the recycling processes do not have any adverse effect on the health and the environment;, make available all records to the Central Pollution Control Board or the concerned State Pollution Control Board for inspection;, ensure that the fractions or material not recycled in its facility is sent to the respective authorised recyclers;, ensure that residue generated during recycling process is disposed of in an authorised treatment storage disposal facility;, maintain record of e-waste collected, dismantled, recycled and sent to authorised recycler in Form-2 and make such record available for scrutiny by the Central Pollution Control Board or the concerned State Pollution Control Board;, file annual returns in Form-3, to the concerned State Pollution Control Board as the case may be, on or before 30th day of June following the financial year to which that return relates;, may accept waste electrical and electronic equipment or components not listed in Schedule I for recycling provided that they do not contain any radioactive material and same shall be indicated while taking the authorisation from concerned State Pollution Control Board;, operation without Authorisation by any recycler, as defined in this rule, shall be considered as causing damage to the environment."
11. Responsibilities of the recycler.,shall ensure that the facility and recycling processes are in accordance with the standards or guidelines prescribed by the Central Pollution Control Board from time to time;
11. Responsibilities of the recycler.,obtain authorisation from concerned State Pollution Control Board in accordance with the procedure under the sub-rule (3) of rule 13;
11. Responsibilities of the recycler.,ensure that no damage is caused to the environment during storage and transportation of e-waste;
11. Responsibilities of the recycler.,ensure that the recycling processes do not have any adverse effect on the health and the environment;
11. Responsibilities of the recycler.,make available all records to the Central Pollution Control Board or the concerned State Pollution Control Board for inspection;
11. Responsibilities of the recycler.,ensure that the fractions or material not recycled in its facility is sent to the respective authorised recyclers;
11. Responsibilities of the recycler.,ensure that residue generated during recycling process is disposed of in an authorised treatment storage disposal facility;
11. Responsibilities of the recycler.,"maintain record of e-waste collected, dismantled, recycled and sent to authorised recycler in Form-2 and make such record available for scrutiny by the Central Pollution Control Board or the concerned State Pollution Control Board;"
11. Responsibilities of the recycler.,"file annual returns in Form-3, to the concerned State Pollution Control Board as the case may be, on or before 30th day of June following the financial year to which that return relates;"
11. Responsibilities of the recycler.,may accept waste electrical and electronic equipment or components not listed in Schedule I for recycling provided that they do not contain any radioactive material and same shall be indicated while taking the authorisation from concerned State Pollution Control Board;
11. Responsibilities of the recycler.,"operation without Authorisation by any recycler, as defined in this rule, shall be considered as causing damage to the environment."
12. Responsibilities of State Government for environmentally sound management of E-waste.,"Department of Industry in State or any other government agency authorised in this regard by the State Government, to ensure earmarking or allocation of industrial space or shed for e-waste dismantling and recycling in the existing and upcoming industrial park, estate and industrial clusters;, Department of Labour in the State or any other government agency authorised in this regard by the State Government shall:, a. ensure recognition and registration of workers involved in dismantling and recycling;, b. assist formation of groups of such workers to facilitate setting up dismantling facilities;, c. undertake industrial skill development activities for the workers involved in dismantling and recycling;, d. undertake annual monitoring and to ensure safety & health of workers involved in dismantling and recycling;, State Government to prepare integrated plan for effective implementation of these provisions, and to submit annual report to Ministry of Environment, Forest and Climate Change."
12. Responsibilities of State Government for environmentally sound management of E-waste.,"Department of Industry in State or any other government agency authorised in this regard by the State Government, to ensure earmarking or allocation of industrial space or shed for e-waste dismantling and recycling in the existing and upcoming industrial park, estate and industrial clusters;"
12. Responsibilities of State Government for environmentally sound management of E-waste.,"Department of Labour in the State or any other government agency authorised in this regard by the State Government shall:, a. ensure recognition and registration of workers involved in dismantling and recycling;, b. assist formation of groups of such workers to facilitate setting up dismantling facilities;, c. undertake industrial skill development activities for the workers involved in dismantling and recycling;, d. undertake annual monitoring and to ensure safety & health of workers involved in dismantling and recycling;"
12. Responsibilities of State Government for environmentally sound management of E-waste.,"State Government to prepare integrated plan for effective implementation of these provisions, and to submit annual report to Ministry of Environment, Forest and Climate Change."
